{
  "$schema": "http://json-schema.org/draft-04/schema#",
  "title": "Facility",
  "description": "Facility Type definition",
  "type": "object",
  "properties": {
    "id": {
      "type": "integer",
      "description": "The unique identifier of the facility"
    },
    "gid": {
      "description": "Global document ID UUID4",
      "type": "string",
      "pattern": "^[a-fA-F0-9]{8}-[a-fA-F0-9]{4}-[a-fA-F0-9]{4}-[a-fA-F0-9]{4}-[a-fA-F0-9]{12}$"
    },
    "facility_code": {
      "type": "string",
      "description": "The unique autogenerated code"
    },
    "version_num": {
      "type": "integer",
      "description": "version number"
    },
    "display_name": {
      "type": "string",
      "description": "Human readable facility name"
    },
    "document_date": {
      "type": "string",
      "pattern": "20[0-9]{2}-[0-1][0-9]-[0-3][0-9]"
    },
    "parent_facility_code": {
      "type": "string",
      "description": "Parent Facility code"
    },
    "facility_type": {
      "description": "Facility hierarchy scope",
      "type": "string",
      "enum": [
        "ENTERPRISE",
        "SITE",
        "AREA",
        "LINE",
        "ZONE"
      ]
    }
  },
  "additionalProperties": false,
  "required": [
    "id",
    "gid",
    "facility_code",
    "display_name",
    "document_date",
    "parent_facility_code",
    "facility_type"
  ]
}
